model,version,table,field,required,ref_table,ref_field,standard,description
omop,4.0.0,organization,location_id,No,location,location_id,,"A foreign key to the geographic location of the administrative offices of the organization in the location table, where the detailed address information is stored. "
omop,4.0.0,organization,organization_id,Yes,,,,"A system-generated unique identifier for each organization. Here, an organization is defined as a collection of one or more care sites that share a single EHR database. "
omop,4.0.0,organization,organization_source_value,Yes,,,,"The identifier for the organization in the source data, stored here for reference. "
omop,4.0.0,organization,place_of_service_concept_id,No,concept,concept_id,CMS,A foreign key that refers to a place of service concept identifier in the vocabulary.
omop,4.0.0,organization,place_of_service_source_value,No,,,,"The source code for the place of service as it appears in the source data, stored here for reference. "