Table,Field,Required,Ref Table,Ref Field,Type Precision,Standard,Description
cohort,cohort_concept_id,Yes,concept,concept_id,integer,,"A foreign key to a standard cohort concept identifier in the vocabulary. Cohort concepts identify the cohorts: whether they are defined through persons, providers or visits, or any combination thereof. "
cohort,cohort_end_date,No,,,date,,"The date when the cohort definition criteria for the person, provider or visit no longer match or the cohort membership was terminated. "
cohort,cohort_id,Yes,,,integer,,A system-generated unique identifier for each cohort record. 
cohort,cohort_start_date,Yes,,,date,,"The date when the cohort definition criteria for the person, provider or visit first match. "
cohort,stop_reason,No,,,string(20),,The reason for the end of a cohort membership other than defined by the cohort definition criteria as it appears in the source data. 
cohort,subject_id,Yes,"person, provider, visit_occurrence","person_id, provider_id, visit_occurrence_id",integer,,"A foreign key to the subject in the cohort. These could be referring to records in the Person, Provider, Visit Occurrence table. "