model,version,table,field,required,ref_table,ref_field,description
pedsnet,1.0.0,procedure_occurrence,associated_provider_id,No,provider,provider_id,A foreign key to the provider in the provider table who was responsible for carrying out the procedure.
pedsnet,1.0.0,procedure_occurrence,person_id,Yes,person,person_id,A foreign key identifier to the person who is subjected to the procedure. The demographic details of that person are stored in the person table.
pedsnet,1.0.0,procedure_occurrence,procedure_concept_id,Yes,concept,concept_id,A foreign key that refers to a standard procedure concept identifier in the Vocabulary.
pedsnet,1.0.0,procedure_occurrence,procedure_date,Yes,,,The date on which the procedure was performed.
pedsnet,1.0.0,procedure_occurrence,procedure_occurrence_id,Yes,,,A system-generated unique identifier for each procedure occurrence. Sites can use any integer- DCC will do a substitution.
pedsnet,1.0.0,procedure_occurrence,procedure_source_value,No,,,"The source code for the procedure as it appears in the source data. This code is mapped to a standard procedure concept in the Vocabulary and the original code is, stored here for reference. Procedure source codes are typically ICD-9-Proc, ICD-10-Proc, CPT-4, HCPCS or OPCS-4 codes."
pedsnet,1.0.0,procedure_occurrence,procedure_type_concept_id,Yes,concept,concept_id,A foreign key to the predefined concept identifier in the Vocabulary reflecting the type of source data from which the procedure record is derived.
pedsnet,1.0.0,procedure_occurrence,relevant_condition_concept_id,No,concept,concept_id,"A foreign key to the predefined concept identifier in the vocabulary reflecting the condition that was the cause for initiation of the procedure. Note that this is not a direct reference to a specific condition record in the condition table, but rather a condition concept in the vocabulary."
pedsnet,1.0.0,procedure_occurrence,visit_occurrence_id,No,visit_occurrence,visit_occurrence_id,A foreign key to the visit in the visit table during which the procedure was carried out.