Table,Field,Required,Ref Table,Ref Field,Type Precision,Description
death,cause_of_death_concept_id,No,concept,concept_id,integer,A foreign key referring to a standard concept identifier in the Vocabulary for conditions.
death,cause_of_death_source_value,No,,,varchar,"The source code for the cause of death as it appears in the source data. This code is mapped to a standard concept in the Vocabulary and the original code is, stored here for reference."
death,cause_source_concept_id,No,concept,concept_id,integer,A foreign key to the vocbaulary concept that refers to the code used in the source.
death,death_date,Yes,,,date,"The date the person was deceased. If the precise date including day or month is not known or not allowed, December is used as the default month, and the last day of the month the default day. If no date available, use date recorded as deceased."
death,death_time,Yes,,,datetime,The date the person was deceased.
death,death_type_concept_id,Yes,concept,concept_id,integer,A foreign key referring to the predefined concept identifier in the Vocabulary reflecting how the death was represented in the source data.
death,person_id,Yes,person,person_id,integer,A foreign key identifier to the deceased person. The demographic details of that person are stored in the person table.